{
  "$schema": "https://json-schema.org/draft/2020-12/schema",
  "title": "data/weeks/YYYY-Www.json",
  "type": "object",
  "required": ["schema_version", "week", "events"],
  "additionalProperties": false,
  "properties": {
    "schema_version": {"const": 1},
    "week": {"$ref": "#/$defs/week_id"},
    "generated_at": {"$ref": "#/$defs/timestamp"},
    "events": {
      "type": "array",
      "items": {"$ref": "#/$defs/event"}
    }
  },
  "$defs": {
    "date": {"type": "string", "pattern": "^\\d{4}-\\d{2}-\\d{2}$"},
    "week_id": {"type": "string", "pattern": "^\\d{4}-W\\d{2}$"},
    "timestamp": {
      "type": "string",
      "pattern": "^\\d{4}-\\d{2}-\\d{2}T\\d{2}:\\d{2}:\\d{2}(\\.\\d+)?([+-]\\d{2}:\\d{2}|Z)$"
    },
    "event": {
      "type": "object",
      "required": [
        "id", "week", "title", "start_at", "end_at", "all_day",
        "venue", "municipality", "categories", "price", "source", "cancelled"
      ],
      "additionalProperties": false,
      "properties": {
        "id": {
          "type": "string",
          "pattern": "^[a-z0-9]+(-[a-z0-9]+)*$",
          "description": "Stabilní slug bez diakritiky. Shodné ID ve více týdnech musí mít shodná identitní pole."
        },
        "week": {"$ref": "#/$defs/week_id"},
        "title": {"type": "string", "minLength": 1},
        "description": {"type": ["string", "null"]},
        "start_at": {"$ref": "#/$defs/timestamp"},
        "end_at": {
          "anyOf": [{"$ref": "#/$defs/timestamp"}, {"type": "null"}],
          "description": "null, pokud konec není zveřejněn. Nikdy se nedomýšlí."
        },
        "all_day": {"type": "boolean"},
        "venue": {"type": ["string", "null"]},
        "municipality": {"type": "string", "minLength": 1},
        "categories": {
          "type": "array",
          "minItems": 1,
          "uniqueItems": true,
          "items": {
            "enum": [
              "hudba", "divadlo", "tanec", "film", "vystavy", "pamatky",
              "vzdelavani", "workshopy", "sport", "gastro", "trhy",
              "festivaly", "slavnosti", "komunitni", "duchovni", "zabava",
              "rodiny", "deti"
            ]
          }
        },
        "price": {
          "type": "object",
          "required": ["type"],
          "additionalProperties": false,
          "properties": {
            "type": {"enum": ["free", "paid", "unknown"]},
            "text": {"type": ["string", "null"]},
            "amount": {"type": ["number", "null"]},
            "currency": {"type": ["string", "null"]}
          }
        },
        "source": {
          "type": "object",
          "required": ["type", "url"],
          "additionalProperties": false,
          "properties": {
            "type": {"type": "string", "minLength": 1},
            "url": {"type": "string", "pattern": "^https?://"}
          }
        },
        "last_verified_at": {
          "anyOf": [{"$ref": "#/$defs/timestamp"}, {"type": "null"}]
        },
        "cancelled": {"type": "boolean"}
      }
    }
  }
}
