{
  "schema_version": 1,
  "week": "2026-W34",
  "generated_at": "2026-08-04T08:31:44+02:00",
  "events": [
    {
      "id": "komentovana-prohlidka-opevneni-chrudim-2026-08-17",
      "week": "2026-W34",
      "title": "Komentovaná prohlídka městského opevnění a bašty Prachárna",
      "description": "Komentovaná prohlídka chrudimského opevnění včetně expozice v baště Prachárna. Sraz je v Turistickém informačním centru na Resselově náměstí.",
      "start_at": "2026-08-17T10:00:00+02:00",
      "end_at": null,
      "all_day": false,
      "venue": "Turistické informační centrum, Resselovo náměstí",
      "municipality": "Chrudim",
      "categories": ["pamatky", "rodiny"],
      "price": {"type": "free", "text": "Zdarma"},
      "source": {"type": "official", "url": "https://www.chrudim.eu/vydejte-se-za-historii-mestskeho-opevneni/"},
      "cancelled": false
    },
    {
      "id": "filmova-noc-bara-cukrkandl-2026-08-21",
      "week": "2026-W34",
      "title": "Filmová noc na Báře – Cukrkandl",
      "description": "Rodinné promítání pod širým nebem u rozhledny Bára. Koná se za příznivého počasí, deky s sebou.",
      "start_at": "2026-08-21T21:00:00+02:00",
      "end_at": "2026-08-21T23:00:00+02:00",
      "all_day": false,
      "venue": "Rozhledna Bára, Podhůra",
      "municipality": "Chrudim",
      "categories": ["film", "rodiny"],
      "price": {"type": "free", "text": "Vstup volný"},
      "source": {"type": "official", "url": "https://www.chrudimskabeseda.cz/akce/filmova-noc-na-bare/"},
      "cancelled": false
    },
    {
      "id": "opekani-burtu-dubina-2026-08-21",
      "week": "2026-W34",
      "title": "Opékání buřtů na Dubině",
      "description": "Sousedské opékání buřtů s country a folkovou hudbou. Vlastní buřty s sebou.",
      "start_at": "2026-08-21T19:00:00+02:00",
      "end_at": "2026-08-21T22:00:00+02:00",
      "all_day": false,
      "venue": "Městský obvod III – Dubina, Jana Zajíce 983",
      "municipality": "Pardubice",
      "categories": ["komunitni", "rodiny", "gastro", "hudba"],
      "price": {"type": "free", "text": "Zdarma"},
      "source": {"type": "official", "url": "https://pardubice.eu/en/roasting-a-pig-on-a-spit-in-dubina"},
      "last_verified_at": "2026-08-02T08:34:00+02:00",
      "cancelled": false
    },
    {
      "id": "filmova-noc-bara-necekane-leto-2026-08-22",
      "week": "2026-W34",
      "title": "Filmová noc na Báře – Nečekané léto",
      "description": "Rodinné promítání pod širým nebem u rozhledny Bára. Koná se za příznivého počasí, deky s sebou.",
      "start_at": "2026-08-22T21:00:00+02:00",
      "end_at": "2026-08-22T23:00:00+02:00",
      "all_day": false,
      "venue": "Rozhledna Bára, Podhůra",
      "municipality": "Chrudim",
      "categories": ["film", "rodiny"],
      "price": {"type": "free", "text": "Vstup volný"},
      "source": {"type": "official", "url": "https://www.chrudimskabeseda.cz/akce/filmova-noc-na-bare-2/"},
      "cancelled": false
    },
    {
      "id": "zlata-pecka-zahajeni-2026-08-23",
      "week": "2026-W34",
      "title": "Slavnostní zahájení festivalu Zlatá Pecka",
      "description": "Slavnostní zahájení festivalu Zlatá Pecka mší a požehnáním v kostele Nanebevzetí Panny Marie.",
      "start_at": "2026-08-23T11:00:00+02:00",
      "end_at": null,
      "all_day": false,
      "venue": "Kostel Nanebevzetí Panny Marie",
      "municipality": "Chrudim",
      "categories": ["festivaly", "hudba", "duchovni"],
      "price": {"type": "free", "text": "Vstup volný"},
      "source": {"type": "regional", "url": "https://www.chrudimka.cz/festival-zlata-pecka-vstoupi-do-jubilejniho-rocnku-slavnosti-shakespearovou"},
      "last_verified_at": "2026-08-02T08:34:00+02:00",
      "cancelled": false
    },
    {
      "id": "carmen-story-chrudim-2026-08-23",
      "week": "2026-W34",
      "title": "Carmen story",
      "description": "Projekce hudebního dokumentu za účasti režisérky Heleny Třeštíkové.",
      "start_at": "2026-08-23T19:00:00+02:00",
      "end_at": null,
      "all_day": false,
      "venue": "Městské kino Chrudim",
      "municipality": "Chrudim",
      "categories": ["film", "hudba", "festivaly"],
      "price": {"type": "paid", "text": "240 Kč"},
      "source": {"type": "official", "url": "https://www.chrudimskabeseda.cz/akce/carmen-story/"},
      "cancelled": false
    },
    {
      "id": "bienale-ve-veci-umeni-nezbytna-prani-2026",
      "week": "2026-W34",
      "title": "Bienále Ve věci umění: Nezbytná přání",
      "description": "Mezinárodní výstava současného umění v Galerii města Pardubic. Akce probíhá od 12. června do 26. září 2026.",
      "start_at": "2026-06-12T10:00:00+02:00",
      "end_at": "2026-09-26T18:00:00+02:00",
      "all_day": false,
      "venue": "GAMPA, Automatické mlýny",
      "municipality": "Pardubice",
      "categories": ["vystavy"],
      "price": {"type": "paid", "text": "Volné vstupné nebo doporučený příspěvek 60 / 100 Kč"},
      "source": {"type": "official", "url": "https://www.automatickemlyny.eu/udalost/bienale-ve-veci-umeni-nezbytna-prani/"},
      "cancelled": false
    },
    {
      "id": "prazdniny-v-knihovne-spolecenske-hry-pardubice-2026-08-19",
      "week": "2026-W34",
      "title": "Prázdniny v knihovně – společenské hry pro děti",
      "description": "Dopolední hraní společenských her pro děti v knihovně v Polabinách.",
      "start_at": "2026-08-19T10:00:00+02:00",
      "end_at": "2026-08-19T12:00:00+02:00",
      "all_day": false,
      "venue": "Knihovna městského obvodu Pardubice II, Družby 334",
      "municipality": "Pardubice",
      "categories": ["zabava", "deti"],
      "price": {"type": "unknown", "text": "Neuvedeno"},
      "source": {"type": "official-calendar", "url": "https://pardubice.eu/prazdniny-v-knihovne-spolecenske-hry-pro-deti"},
      "last_verified_at": "2026-08-04T08:11:12+02:00",
      "cancelled": false
    },
    {
      "id": "prazdninova-joga-na-prihradku-pardubice-2026-08-20",
      "week": "2026-W34",
      "title": "Prázdninová jóga na Příhrádku",
      "description": "Ranní lekce jógy s protažením, posílením a relaxací; vlastní jogamatku s sebou.",
      "start_at": "2026-08-20T09:00:00+02:00",
      "end_at": "2026-08-20T10:00:00+02:00",
      "all_day": false,
      "venue": "Louka pod terasou Příhrádku, Příhrádek 6–8",
      "municipality": "Pardubice",
      "categories": ["sport"],
      "price": {"type": "free", "text": "Zdarma"},
      "source": {"type": "official-calendar", "url": "https://pardubice.eu/prazdninova-joga-na-prihradku-42174"},
      "last_verified_at": "2026-08-04T08:11:12+02:00",
      "cancelled": false
    },
    {
      "id": "zapad-slunce-zelena-brana-pardubice-2026-08-21",
      "week": "2026-W34",
      "title": "Západ slunce na Zelené bráně",
      "description": "Večerní návštěva ochozu Zelené brány s výhledem na historické centrum za příznivého počasí.",
      "start_at": "2026-08-21T19:00:00+02:00",
      "end_at": "2026-08-21T22:00:00+02:00",
      "all_day": false,
      "venue": "Zelená brána, Zelenobranská 68",
      "municipality": "Pardubice",
      "categories": ["pamatky", "rodiny"],
      "price": {"type": "paid", "text": "Dle běžného ceníku"},
      "source": {"type": "official-calendar", "url": "https://pardubice.eu/zapady-slunce-na-zelene-brane-42875"},
      "last_verified_at": "2026-08-04T08:31:44+02:00",
      "cancelled": false
    },
    {
      "id": "zapad-slunce-zelena-brana-pardubice-2026-08-22",
      "week": "2026-W34",
      "title": "Západ slunce na Zelené bráně",
      "description": "Večerní návštěva ochozu Zelené brány s výhledem na historické centrum za příznivého počasí.",
      "start_at": "2026-08-22T19:00:00+02:00",
      "end_at": "2026-08-22T22:00:00+02:00",
      "all_day": false,
      "venue": "Zelená brána, Zelenobranská 68",
      "municipality": "Pardubice",
      "categories": ["pamatky", "rodiny"],
      "price": {"type": "paid", "text": "Dle běžného ceníku"},
      "source": {"type": "official-calendar", "url": "https://pardubice.eu/zapady-slunce-na-zelene-brane-42875"},
      "last_verified_at": "2026-08-04T08:31:44+02:00",
      "cancelled": false
    }
  ]
}
