{
  "schema_version": 1,
  "week": "2026-W36",
  "generated_at": "2026-08-02T08:40:00+02:00",
  "events": [
    {
      "id": "siebeneichener-quartett-peckova-pavlica-dropp-2026-08-31",
      "week": "2026-W36",
      "title": "SIEBENEICHENER Quartett & Dagmar Pecková, Jiří Pavlica, Martin Dropp",
      "description": "Koncert festivalu Zlatá Pecka v Muzeu barokních soch.",
      "start_at": "2026-08-31T19:00:00+02:00",
      "end_at": null,
      "all_day": false,
      "venue": "Muzeum barokních soch",
      "municipality": "Chrudim",
      "categories": ["hudba", "festivaly"],
      "price": {"type": "unknown", "text": "Cena není v dostupném oficiálním detailu uvedena"},
      "source": {"type": "official", "url": "https://www.chrudimskabeseda.cz/akce/siebeneichener-quartett-dagmar-peckova-jiri-pavlica-martin-dropp/"},
      "last_verified_at": "2026-08-02T08:40:00+02:00",
      "cancelled": false
    },
    {
      "id": "kral-lear-chrudim-2026-09-01",
      "week": "2026-W36",
      "title": "William Shakespeare: Král Lear",
      "description": "Představení Spolku Kašpar Divadla v Celetné v rámci festivalu Zlatá Pecka.",
      "start_at": "2026-09-01T19:00:00+02:00",
      "end_at": null,
      "all_day": false,
      "venue": "Velká scéna Divadla Karla Pippicha",
      "municipality": "Chrudim",
      "categories": ["divadlo", "festivaly"],
      "price": {"type": "unknown", "text": "Cena není v dostupném oficiálním detailu uvedena"},
      "source": {"type": "official", "url": "https://www.chrudimskabeseda.cz/akce/william-shakespeare-kral-lear/"},
      "last_verified_at": "2026-08-02T08:40:00+02:00",
      "cancelled": false
    },
    {
      "id": "lenny-chrudimske-dozinky-2026-09-04",
      "week": "2026-W36",
      "title": "LENNY – koncert",
      "description": "Koncert zpěvačky Lenny v rámci folklórního festivalu Chrudimské dožínky.",
      "start_at": "2026-09-04T19:00:00+02:00",
      "end_at": null,
      "all_day": false,
      "venue": "Klášterní zahrady",
      "municipality": "Chrudim",
      "categories": ["hudba", "festivaly"],
      "price": {"type": "paid", "text": "590 Kč v předprodeji, 650 Kč na místě"},
      "source": {"type": "official", "url": "https://www.chrudimskabeseda.cz/akce/chrudimske-dozinky-koncert-lenny/"},
      "cancelled": false
    },
    {
      "id": "chrudimske-dozinky-2026",
      "week": "2026-W36",
      "title": "Chrudimské dožínky – folklórní festival",
      "description": "Třídenní folklórní festival s koncertem, přehlídkou souborů, jarmarkem, dětským programem, Food Day Festivalem a nedělní bohoslužbou.",
      "start_at": "2026-09-04T19:00:00+02:00",
      "end_at": "2026-09-06T12:00:00+02:00",
      "all_day": false,
      "venue": "Klášterní zahrady a centrum Chrudimi",
      "municipality": "Chrudim",
      "categories": ["festivaly", "slavnosti", "trhy", "rodiny", "gastro"],
      "price": {"type": "free", "text": "Hlavní program zdarma; koncert Lenny je placený"},
      "source": {"type": "official", "url": "https://www.chrudimskabeseda.cz/akce/chrudimske-dozinky-folklorni-festival/"},
      "cancelled": false
    },
    {
      "id": "den-pardubickeho-kraje-zamek-2026-09-05",
      "week": "2026-W36",
      "title": "Den Pardubického kraje na zámku",
      "description": "Celodenní program Východočeského muzea s volným vstupem do expozic a výstav, dětským programem a soutěžní královskou cestou mezi kulturními institucemi.",
      "start_at": "2026-09-05T10:00:00+02:00",
      "end_at": "2026-09-05T17:00:00+02:00",
      "all_day": false,
      "venue": "Zámek Pardubice",
      "municipality": "Pardubice",
      "categories": ["vystavy", "rodiny", "pamatky"],
      "price": {"type": "free", "text": "Zdarma"},
      "source": {"type": "official", "url": "https://www.zamekpardubice.cz/navstivte-nas/akce/den-pardubickeho-kraje-2026/"},
      "cancelled": false
    },
    {
      "id": "rodinna-anamneza-chrudim-2026",
      "week": "2026-W36",
      "title": "Rodinná anamnéza",
      "description": "Výstava Jaroslava Korečka, Markéty Korečkové a Juliany Mackové probíhající od 16. července do 13. září 2026.",
      "start_at": "2026-07-16T00:00:00+02:00",
      "end_at": "2026-09-13T23:59:00+02:00",
      "all_day": true,
      "venue": "Výstavní síň Chrudim – Divadlo Karla Pippicha",
      "municipality": "Chrudim",
      "categories": ["vystavy"],
      "price": {"type": "paid", "text": "20 Kč"},
      "source": {"type": "official", "url": "https://www.chrudimskabeseda.cz/akce/rodinna-anamneza-jaroslav-korecek-marketa-koreckova-juliana-mackova/"},
      "last_verified_at": "2026-08-02T08:40:00+02:00",
      "cancelled": false
    }
  ]
}
